{
  "id": "adonalsium-exists",
  "title": "Existence of Adonalsium",
  "summary": "Adonalsium, the primordial being from which all Investiture emanates, exists as the only divine entity in the Cosmere. Its power is not divided.",
  "year": -20000,
  "endYear": null,
  "type": "historical",
  "series": "pre-cosmere",
  "planets": [],
  "characters": [],
  "worldhoppers": [],
  "importance": 5,
  "archivistNote": null
}
