{
  "id": "hoid-offered-shard",
  "title": "Offer of a Shard to Hoid",
  "summary": "Immediately after the Shattering, Hoid is offered a Shard of Adonalsium, but he refuses the power. He will later regret this decision.",
  "year": -10000,
  "endYear": null,
  "type": "historical",
  "series": "pre-cosmere",
  "planets": [],
  "characters": [],
  "worldhoppers": ["wh-hoid"],
  "importance": 5,
  "archivistNote": "The exact identity of the sixteenth Vessel remains a subject of intense debate among Silverlight scholars. Some records suggest a name that has been deliberately erased from every known account."
}
